[
  {
    "prescription_id": "RX-DEMO-50000",
    "synthetic": true,
    "data_source": "call-center-demo-synth-v1",
    "member_id": "MBR-DEMO-000101",
    "prescribing_provider_id": "PRV-DEMO-2002",
    "drug_name": "Lisinopril 10mg",
    "dosage": "1 tablet daily",
    "status": "ACTIVE",
    "prior_authorization_required": false,
    "prior_authorization_status": "NOT_REQUIRED",
    "refills_remaining": 3,
    "last_filled_date": "2026-08-15",
    "next_refill_eligible_date": "2026-09-05",
    "formulary_tier": 1,
    "pharmacy_name": "Riverside Pharmacy",
    "pharmacy_phone": "555-0301-1000"
  },
  {
    "prescription_id": "RX-DEMO-50001",
    "synthetic": true,
    "data_source": "call-center-demo-synth-v1",
    "member_id": "MBR-DEMO-000101",
    "prescribing_provider_id": "PRV-DEMO-2002",
    "drug_name": "Atorvastatin 20mg",
    "dosage": "1 tablet at bedtime",
    "status": "ACTIVE",
    "prior_authorization_required": false,
    "prior_authorization_status": "NOT_REQUIRED",
    "refills_remaining": 2,
    "last_filled_date": "2026-09-10",
    "next_refill_eligible_date": "2026-10-10",
    "formulary_tier": 1,
    "pharmacy_name": "Riverside Pharmacy",
    "pharmacy_phone": "555-0301-1000"
  },
  {
    "prescription_id": "RX-DEMO-50002",
    "synthetic": true,
    "data_source": "call-center-demo-synth-v1",
    "member_id": "MBR-DEMO-000102",
    "prescribing_provider_id": "PRV-DEMO-2003",
    "drug_name": "Humira 40mg",
    "dosage": "1 injection every 2 weeks",
    "status": "PENDING_PRIOR_AUTH",
    "prior_authorization_required": true,
    "prior_authorization_status": "PENDING",
    "refills_remaining": 0,
    "last_filled_date": null,
    "next_refill_eligible_date": null,
    "formulary_tier": 4,
    "pharmacy_name": "Westgate Specialty Pharmacy",
    "pharmacy_phone": "555-0302-2000"
  },
  {
    "prescription_id": "RX-DEMO-50003",
    "synthetic": true,
    "data_source": "call-center-demo-synth-v1",
    "member_id": "MBR-DEMO-000103",
    "prescribing_provider_id": "PRV-DEMO-2004",
    "drug_name": "Ozempic 1mg",
    "dosage": "1 injection weekly",
    "status": "PRIOR_AUTH_DENIED",
    "prior_authorization_required": true,
    "prior_authorization_status": "DENIED",
    "refills_remaining": 0,
    "last_filled_date": "2026-06-01",
    "next_refill_eligible_date": null,
    "formulary_tier": 3,
    "pharmacy_name": "Riverside Pharmacy",
    "pharmacy_phone": "555-0301-1000"
  },
  {
    "prescription_id": "RX-DEMO-50004",
    "synthetic": true,
    "data_source": "call-center-demo-synth-v1",
    "member_id": "MBR-DEMO-000104",
    "prescribing_provider_id": "PRV-DEMO-2005",
    "drug_name": "Metformin 500mg",
    "dosage": "2 tablets daily",
    "status": "ACTIVE",
    "prior_authorization_required": false,
    "prior_authorization_status": "NOT_REQUIRED",
    "refills_remaining": 5,
    "last_filled_date": "2026-08-20",
    "next_refill_eligible_date": "2026-09-01",
    "formulary_tier": 1,
    "pharmacy_name": "Downtown Pharmacy",
    "pharmacy_phone": "555-0303-3000"
  },
  {
    "prescription_id": "RX-DEMO-50005",
    "synthetic": true,
    "data_source": "call-center-demo-synth-v1",
    "member_id": "MBR-DEMO-000104",
    "prescribing_provider_id": "PRV-DEMO-2005",
    "drug_name": "Albuterol Inhaler",
    "dosage": "2 puffs as needed",
    "status": "ACTIVE",
    "prior_authorization_required": false,
    "prior_authorization_status": "NOT_REQUIRED",
    "refills_remaining": 1,
    "last_filled_date": "2026-07-05",
    "next_refill_eligible_date": "2026-08-05",
    "formulary_tier": 2,
    "pharmacy_name": "Downtown Pharmacy",
    "pharmacy_phone": "555-0303-3000"
  },
  {
    "prescription_id": "RX-DEMO-50006",
    "synthetic": true,
    "data_source": "call-center-demo-synth-v1",
    "member_id": "MBR-DEMO-000105",
    "prescribing_provider_id": "PRV-DEMO-2006",
    "drug_name": "Amoxicillin 500mg",
    "dosage": "1 capsule 3x daily",
    "status": "EXPIRED",
    "prior_authorization_required": false,
    "prior_authorization_status": "NOT_REQUIRED",
    "refills_remaining": 0,
    "last_filled_date": "2026-05-12",
    "next_refill_eligible_date": null,
    "formulary_tier": 1,
    "pharmacy_name": "Riverside Pharmacy",
    "pharmacy_phone": "555-0301-1000"
  },
  {
    "prescription_id": "RX-DEMO-50007",
    "synthetic": true,
    "data_source": "call-center-demo-synth-v1",
    "member_id": "MBR-DEMO-000108",
    "prescribing_provider_id": "PRV-DEMO-2007",
    "drug_name": "Sertraline 50mg",
    "dosage": "1 tablet daily",
    "status": "ACTIVE",
    "prior_authorization_required": false,
    "prior_authorization_status": "NOT_REQUIRED",
    "refills_remaining": 4,
    "last_filled_date": "2026-08-25",
    "next_refill_eligible_date": "2026-09-10",
    "formulary_tier": 2,
    "pharmacy_name": "Westgate Specialty Pharmacy",
    "pharmacy_phone": "555-0302-2000"
  },
  {
    "prescription_id": "RX-DEMO-50008",
    "synthetic": true,
    "data_source": "call-center-demo-synth-v1",
    "member_id": "MBR-DEMO-000112",
    "prescribing_provider_id": "PRV-DEMO-2008",
    "drug_name": "Levothyroxine 75mcg",
    "dosage": "1 tablet daily",
    "status": "ACTIVE",
    "prior_authorization_required": false,
    "prior_authorization_status": "NOT_REQUIRED",
    "refills_remaining": 2,
    "last_filled_date": "2026-09-01",
    "next_refill_eligible_date": "2026-09-25",
    "formulary_tier": 1,
    "pharmacy_name": "Downtown Pharmacy",
    "pharmacy_phone": "555-0303-3000"
  },
  {
    "prescription_id": "RX-DEMO-50009",
    "synthetic": true,
    "data_source": "call-center-demo-synth-v1",
    "member_id": "MBR-DEMO-000118",
    "prescribing_provider_id": "PRV-DEMO-2009",
    "drug_name": "Montelukast 10mg",
    "dosage": "1 tablet at bedtime",
    "status": "ACTIVE",
    "prior_authorization_required": false,
    "prior_authorization_status": "NOT_REQUIRED",
    "refills_remaining": 3,
    "last_filled_date": "2026-08-18",
    "next_refill_eligible_date": "2026-09-08",
    "formulary_tier": 2,
    "pharmacy_name": "Riverside Pharmacy",
    "pharmacy_phone": "555-0301-1000"
  }
]
